{
  "sidecar_id": "astellas.awareness",
  "description": "Intent policy for high-level 'awareness' courses on the Astellas shell (e.g. GEN607 Intro to Medical Device QMS). Favors light treatments; reserves interactions for genuine reveals/decisions. Manifold-conformant: selection fires on governed intent signals; bindings select scene elements by facet, so every filled slot resolves to an element_id.",
  "template_ref": {
    "manifest": "templates/astellas/template_manifest.example.json",
    "sha256": "0000000000000000000000000000000000000000000000000000000000000000"
  },
  "token_overrides": {},
  "interaction_defaults": {
    "button_labels": {
      "continue": "Continue",
      "submit": "Submit"
    },
    "attempts": 2,
    "gating": true
  },
  "selection": [
    {
      "id": "knowledge_check_to_kc",
      "when": {
        "script_primitive": [
          "knowledge_check"
        ]
      },
      "use": "KC_SINGLE",
      "note": "A knowledge_check primitive routes to the single-best KC. (Governed replacement for the old flags:['assessment'] rule.)"
    },
    {
      "id": "scenario_select_to_sort",
      "when": {
        "requested_interaction": [
          "scenario_select"
        ]
      },
      "use": "SCENARIO_SORT",
      "note": "Routes on the governed interaction key. A former primary rule fired on a script_primitive 'scenario' that no version of script.primitives declares (11 governed types, no scenario); it was removed 2026-08-30 rather than silently accepted. Adding a 12th primitive is a vocabulary decision (DECISIONS.md), not a sidecar edit."
    },
    {
      "id": "reveal_to_grid",
      "when": {
        "requested_interaction": [
          "click_reveal"
        ],
        "child_count": {
          "min": 2,
          "max": 4
        }
      },
      "use": "REVEAL_GRID",
      "note": "2-4 explorable items with a reveal interaction become a click-to-reveal grid. (Governed replacement for potential_interaction:['reveal','click'] + key_concepts_count.)"
    },
    {
      "id": "convergence_to_venn",
      "when": {
        "script_primitive": [
          "distinction"
        ],
        "visual_type": [
          "diagram"
        ]
      },
      "use": "DIAGRAM_VENN",
      "note": "A distinction drawn as a diagram (set overlap / convergence, e.g. combination products). (Governed replacement for suggested_visual_type + flags:['convergence'].)"
    },
    {
      "id": "peer_set_to_static_cards",
      "when": {
        "script_primitive": [
          "decomposition"
        ],
        "child_count": {
          "min": 3,
          "max": 3
        }
      },
      "use": "STATIC_CARDS_3",
      "note": "A three-part decomposition with no interaction: show the peers statically. Falls through here only if no interaction rule above matched."
    }
  ],
  "default_layout": "TITLE_BODY",
  "bindings": {
    "TITLE_BODY": {
      "map": {
        "Title": {
          "scope": "child",
          "where": {
            "rhetorical": [
              "orient"
            ]
          },
          "take": "content.text"
        },
        "Body": {
          "scope": "children",
          "where": {
            "type": [
              "Statement",
              "Paragraph",
              "List",
              "Impact"
            ]
          },
          "take": "content.text",
          "order_by": "structure.sequence_index"
        }
      },
      "overflow": "split_slide"
    },
    "STATIC_CARDS_3": {
      "map": {
        "Title": {
          "scope": "child",
          "where": {
            "rhetorical": [
              "orient"
            ]
          }
        },
        "Intro": {
          "scope": "child",
          "where": {
            "type": [
              "Statement",
              "Paragraph"
            ]
          }
        },
        "StandardsNote": {
          "scope": "descendant",
          "where": {
            "content_role": [
              "standards_note"
            ]
          }
        }
      },
      "repeat": {
        "slot": "Card",
        "source": {
          "scope": "descendants",
          "where": {
            "type": [
              "Bullet"
            ]
          },
          "order_by": "structure.sequence_index"
        },
        "item_map": {
          "label": {
            "scope": "self",
            "take": "content.text"
          },
          "body": {
            "scope": "child",
            "where": {
              "type": [
                "Statement",
                "Paragraph"
              ]
            }
          }
        },
        "min": 3,
        "max": 3
      },
      "overflow": "shrink"
    },
    "REVEAL_GRID": {
      "map": {
        "Title": {
          "scope": "child",
          "where": {
            "rhetorical": [
              "orient"
            ]
          }
        },
        "Prompt": {
          "scope": "child",
          "where": {
            "type": [
              "Statement",
              "Paragraph"
            ]
          }
        },
        "StandardsNote": {
          "scope": "descendant",
          "where": {
            "content_role": [
              "standards_note"
            ]
          }
        }
      },
      "repeat": {
        "slot": "Card",
        "source": {
          "scope": "descendants",
          "where": {
            "type": [
              "Bullet"
            ]
          },
          "order_by": "structure.sequence_index"
        },
        "item_map": {
          "front": {
            "scope": "self",
            "take": "content.text"
          },
          "body": {
            "scope": "child",
            "where": {
              "type": [
                "Statement",
                "Paragraph"
              ]
            }
          }
        },
        "min": 2,
        "max": 4
      },
      "overflow": "truncate_flag"
    },
    "SCENARIO_SORT": {
      "map": {
        "Title": {
          "scope": "child",
          "where": {
            "rhetorical": [
              "orient"
            ]
          }
        },
        "Stem": {
          "scope": "child",
          "where": {
            "content_role": [
              "stem"
            ]
          }
        }
      },
      "repeat": {
        "slot": "Option",
        "source": {
          "scope": "descendants",
          "where": {
            "content_role": [
              "option"
            ]
          },
          "order_by": "structure.sequence_index"
        },
        "item_map": {
          "label": {
            "scope": "self",
            "take": "content.text"
          },
          "verdict": {
            "scope": "self",
            "take": "assessment.correct_option"
          },
          "body": {
            "scope": "child",
            "where": {
              "content_role": [
                "feedback"
              ]
            }
          }
        },
        "min": 2,
        "max": 4
      },
      "overflow": "truncate_flag"
    },
    "DIAGRAM_VENN": {
      "map": {
        "WhyPanel": {
          "scope": "child",
          "where": {
            "type": [
              "Statement",
              "Paragraph"
            ]
          }
        }
      },
      "repeat": {
        "slot": "Callout",
        "source": {
          "scope": "descendants",
          "where": {
            "content_role": [
              "callout"
            ]
          },
          "order_by": "structure.sequence_index"
        },
        "item_map": {
          "name": {
            "scope": "self",
            "take": "content.text"
          }
        },
        "min": 0,
        "max": 4
      },
      "overflow": "shrink"
    },
    "KC_SINGLE": {
      "map": {
        "Title": {
          "scope": "child",
          "where": {
            "rhetorical": [
              "orient"
            ]
          }
        },
        "Stem": {
          "scope": "child",
          "where": {
            "content_role": [
              "stem"
            ]
          }
        }
      },
      "repeat": {
        "slot": "Choice",
        "source": {
          "scope": "descendants",
          "where": {
            "content_role": [
              "choice"
            ]
          },
          "order_by": "structure.sequence_index"
        },
        "item_map": {
          "text": {
            "scope": "self",
            "take": "content.text"
          },
          "correct": {
            "scope": "self",
            "take": "assessment.correct_option"
          },
          "feedback": {
            "scope": "child",
            "where": {
              "content_role": [
                "feedback"
              ]
            }
          }
        },
        "min": 3,
        "max": 4
      },
      "overflow": "shrink"
    }
  }
}